{
  "$schema": "https://json-schema.org/draft/2020-12/schema",
  "$defs": {
    "badDebtPercent": {
      "type": "string",
      "pattern": "^[0-9]+\\.[0-9]{2}$",
      "description": "Percentage, 2 decimal places, no % suffix (e.g. \"6.00\")"
    },
    "cost": {
      "type": "string",
      "pattern": "^-?[0-9]+\\.[0-9]{2}$",
      "description": "GBP cost, 2 decimal places, no £ prefix (e.g. \"1234.56\")"
    },
    "costOrNull": {
      "type": ["string", "null"],
      "pattern": "^-?[0-9]+\\.[0-9]{2}$",
      "description": "GBP cost, 2 decimal places, no £ prefix, or null when not applicable"
    },
    "pricePerTonne": {
      "type": "string",
      "pattern": "^[0-9]+\\.[0-9]{4}$",
      "description": "Price per tonne, 4 decimal places, no £ prefix (e.g. \"0.2105\")"
    },
    "fee": {
      "type": "object",
      "description": "A fee with base amount and bad debt provision",
      "required": ["base", "badDebtProvision"],
      "properties": {
        "base":             { "$ref": "#/$defs/cost" },
        "badDebtProvision": { "$ref": "#/$defs/cost" }
      }
    },
    "feeWithCountries": {
      "type": "object",
      "description": "A fee breakdown: base amount, bad debt provision, total (with bad debt), and country splits",
      "required": ["base", "badDebtProvision", "total", "england", "wales", "scotland", "northernIreland"],
      "properties": {
        "base":             { "$ref": "#/$defs/cost" },
        "badDebtProvision": { "$ref": "#/$defs/cost" },
        "total":            { "$ref": "#/$defs/cost" },
        "england":          { "$ref": "#/$defs/cost" },
        "wales":            { "$ref": "#/$defs/cost" },
        "scotland":         { "$ref": "#/$defs/cost" },
        "northernIreland":  { "$ref": "#/$defs/cost" }
      }
    }
  },
  "type": "object",
  "required": ["$schema", "runId", "financialYear", "badDebtProvisionPercentage", "materials", "producers"],
  "properties": {
    "$schema": { "const": "https://epr.gov.uk/schemas/billing/2025/v1" },
    "runId": { "type": "integer" },
    "financialYear": {
      "type": "string",
      "pattern": "^[0-9]{4}-[0-9]{2}$",
      "description": "Financial year in YYYY-YY format (e.g. \"2025-26\")"
    },
    "badDebtProvisionPercentage": { "$ref": "#/$defs/badDebtPercent" },

    "materials": {
      "type": "array",
      "description": "Run-level per-material price data; same for all producers — join by materialName",
      "items": {
        "type": "object",
        "required": ["material", "disposalPricePerTonne", "commsPricePerTonne"],
        "properties": {
          "material":          { "type": "string" },
          "disposalPricePerTonne": { "$ref": "#/$defs/pricePerTonne" },
          "commsPricePerTonne":    { "$ref": "#/$defs/pricePerTonne" }
        }
      }
    },

    "producers": {
      "type": "array",
      "items": {
        "type": "object",
        "required": [
          "producerName", "producerID", "subsidiaryID", "level",
          "totalBill", "invoice",
          "disposalFeesByMaterial",
          "disposalCosts",
          "commsCostsByMaterial",
          "commsCostsUKWide",
          "commsCostsByCountry",
          "saOperatingCosts",
          "laDataPrepCosts",
          "saSetUpCosts"
        ],
        "properties": {
          "producerName": { "type": "string" },
          "producerID":   { "type": "string" },
          "subsidiaryID": { "type": "string" },
          "level":        { "type": "integer" },

          "totalBill": { "$ref": "#/$defs/cost" },

          "invoice": {
            "type": "object",
            "required": ["instruction", "suggestedAmount", "invoicedToDate"],
            "properties": {
              "instruction":     { "type": "string", "enum": ["", "-", "INITIAL", "DELTA", "REBILL"] },
              "suggestedAmount": { "$ref": "#/$defs/costOrNull" },
              "invoicedToDate":  { "$ref": "#/$defs/costOrNull" }
            }
          },

          "disposalFeesByMaterial": {
            "type": "array",
            "description": "Per-material tonnage and fee breakdown for LA disposal costs (section 1)",
            "items": {
              "type": "object",
              "required": [
                "material",
                "householdPackagingWasteTonnage",
                "publicBinTonnage",
                "totalTonnage",
                "selfManagedConsumerWasteTonnage",
                "netTonnage",
                "feeWithoutBadDebt",
                "badDebtProvision",
                "fee",
                "england", "wales", "scotland", "northernIreland",
                "previousInvoicedTonnage",
                "tonnageChange"
              ],
              "properties": {
                "material":                           { "type": "string" },
                "householdPackagingWasteTonnage":          { "type": "number" },
                "publicBinTonnage":                       { "type": "number" },
                "householdDrinksContainersTonnageGlass":  { "type": "number" },
                "totalTonnage":                           { "type": "number" },
                "selfManagedConsumerWasteTonnage":         { "type": "number" },
                "netTonnage":                             { "type": "number" },
                "feeWithoutBadDebt":                      { "$ref": "#/$defs/cost" },
                "badDebtProvision":                       { "$ref": "#/$defs/cost" },
                "fee":                                    { "$ref": "#/$defs/cost" },
                "england":                                { "$ref": "#/$defs/cost" },
                "wales":                                  { "$ref": "#/$defs/cost" },
                "scotland":                               { "$ref": "#/$defs/cost" },
                "northernIreland":                        { "$ref": "#/$defs/cost" },
                "previousInvoicedTonnage":                { "type": "string" },
                "tonnageChange":                          { "type": "string" }
              }
            }
          },

          "disposalCosts":        { "$ref": "#/$defs/feeWithCountries" },
          "commsCostsByMaterial": { "$ref": "#/$defs/fee" },
          "commsCostsUKWide":     { "$ref": "#/$defs/fee" },
          "commsCostsByCountry":  { "$ref": "#/$defs/fee" },
          "saOperatingCosts":     { "$ref": "#/$defs/fee" },
          "laDataPrepCosts":      { "$ref": "#/$defs/fee" },
          "saSetUpCosts":         { "$ref": "#/$defs/fee" }
        }
      }
    }
  }
}
