{
  "$schema": "https://epr.gov.uk/schemas/billing/2025/v1",
  "runId": 1,
  "financialYear": "2025-26",
  "badDebtProvisionPercentage": "4.00",
  "materials": [
    {
      "material": "Aluminium",
      "disposalPricePerTonne": "0.0046",
      "commsPricePerTonne": "0.0013"
    },
    {
      "material": "Fibre composite",
      "disposalPricePerTonne": "0.0007",
      "commsPricePerTonne": "0.0004"
    },
    {
      "material": "Glass",
      "disposalPricePerTonne": "0.0053",
      "commsPricePerTonne": "0.0004"
    },
    {
      "material": "Paper or card",
      "disposalPricePerTonne": "0.0132",
      "commsPricePerTonne": "0.0060"
    },
    {
      "material": "Plastic",
      "disposalPricePerTonne": "0.0049",
      "commsPricePerTonne": "0.0012"
    },
    {
      "material": "Steel",
      "disposalPricePerTonne": "0.0126",
      "commsPricePerTonne": "0.0057"
    },
    {
      "material": "Wood",
      "disposalPricePerTonne": "0.0081",
      "commsPricePerTonne": "0.0006"
    },
    {
      "material": "Other materials",
      "disposalPricePerTonne": "0.0008",
      "commsPricePerTonne": "0.0007"
    }
  ],
  "producers": [
    {
      "producerName": "",
      "producerID": "110000",
      "subsidiaryID": "",
      "level": 1,
      "totalBill": "26190915.36",
      "invoice": {
        "instruction": "INITIAL",
        "suggestedAmount": "26190915.36",
        "invoicedToDate": null
      },
      "disposalFeesByMaterial": [
        {
          "material": "Aluminium",
          "previousInvoicedTonnage": "-",
          "householdPackagingWasteTonnage": 4184.395,
          "publicBinTonnage": 0,
          "totalTonnage": 4184.395,
          "selfManagedConsumerWasteTonnage": 0,
          "netTonnage": 4184.395,
          "feeWithoutBadDebt": "19.25",
          "tonnageChange": "-",
          "badDebtProvision": "0.77",
          "fee": "20.02",
          "england": "10.82",
          "wales": "2.44",
          "scotland": "4.86",
          "northernIreland": "1.90"
        },
        {
          "material": "Fibre composite",
          "previousInvoicedTonnage": "-",
          "householdPackagingWasteTonnage": 0,
          "publicBinTonnage": 0,
          "totalTonnage": 0,
          "selfManagedConsumerWasteTonnage": 0,
          "netTonnage": 0,
          "feeWithoutBadDebt": "0.00",
          "tonnageChange": "-",
          "badDebtProvision": "0.00",
          "fee": "0.00",
          "england": "0.00",
          "wales": "0.00",
          "scotland": "0.00",
          "northernIreland": "0.00"
        },
        {
          "material": "Glass",
          "previousInvoicedTonnage": "-",
          "householdPackagingWasteTonnage": 0,
          "publicBinTonnage": 0,
          "householdDrinksContainersTonnageGlass": 0,
          "totalTonnage": 0,
          "selfManagedConsumerWasteTonnage": 0,
          "netTonnage": 0,
          "feeWithoutBadDebt": "0.00",
          "tonnageChange": "-",
          "badDebtProvision": "0.00",
          "fee": "0.00",
          "england": "0.00",
          "wales": "0.00",
          "scotland": "0.00",
          "northernIreland": "0.00"
        },
        {
          "material": "Paper or card",
          "previousInvoicedTonnage": "-",
          "householdPackagingWasteTonnage": 0,
          "publicBinTonnage": 0,
          "totalTonnage": 0,
          "selfManagedConsumerWasteTonnage": 0,
          "netTonnage": 0,
          "feeWithoutBadDebt": "0.00",
          "tonnageChange": "-",
          "badDebtProvision": "0.00",
          "fee": "0.00",
          "england": "0.00",
          "wales": "0.00",
          "scotland": "0.00",
          "northernIreland": "0.00"
        },
        {
          "material": "Plastic",
          "previousInvoicedTonnage": "-",
          "householdPackagingWasteTonnage": 0,
          "publicBinTonnage": 0,
          "totalTonnage": 0,
          "selfManagedConsumerWasteTonnage": 0,
          "netTonnage": 0,
          "feeWithoutBadDebt": "0.00",
          "tonnageChange": "-",
          "badDebtProvision": "0.00",
          "fee": "0.00",
          "england": "0.00",
          "wales": "0.00",
          "scotland": "0.00",
          "northernIreland": "0.00"
        },
        {
          "material": "Steel",
          "previousInvoicedTonnage": "-",
          "householdPackagingWasteTonnage": 0,
          "publicBinTonnage": 0,
          "totalTonnage": 0,
          "selfManagedConsumerWasteTonnage": 0,
          "netTonnage": 0,
          "feeWithoutBadDebt": "0.00",
          "tonnageChange": "-",
          "badDebtProvision": "0.00",
          "fee": "0.00",
          "england": "0.00",
          "wales": "0.00",
          "scotland": "0.00",
          "northernIreland": "0.00"
        },
        {
          "material": "Wood",
          "previousInvoicedTonnage": "-",
          "householdPackagingWasteTonnage": 0,
          "publicBinTonnage": 0,
          "totalTonnage": 0,
          "selfManagedConsumerWasteTonnage": 0,
          "netTonnage": 0,
          "feeWithoutBadDebt": "0.00",
          "tonnageChange": "-",
          "badDebtProvision": "0.00",
          "fee": "0.00",
          "england": "0.00",
          "wales": "0.00",
          "scotland": "0.00",
          "northernIreland": "0.00"
        },
        {
          "material": "Other materials",
          "previousInvoicedTonnage": "-",
          "householdPackagingWasteTonnage": 0,
          "publicBinTonnage": 0,
          "totalTonnage": 0,
          "selfManagedConsumerWasteTonnage": 0,
          "netTonnage": 0,
          "feeWithoutBadDebt": "0.00",
          "tonnageChange": "-",
          "badDebtProvision": "0.00",
          "fee": "0.00",
          "england": "0.00",
          "wales": "0.00",
          "scotland": "0.00",
          "northernIreland": "0.00"
        }
      ],
      "disposalCosts": {
        "base": "19.25",
        "badDebtProvision": "0.77",
        "total": "20.02",
        "england": "10.82",
        "wales": "2.44",
        "scotland": "4.86",
        "northernIreland": "1.90"
      },
      "commsCostsByMaterial": {
        "base": "5.44",
        "badDebtProvision": "0.22"
      },
      "commsCostsUKWide": {
        "base": "21279.03",
        "badDebtProvision": "851.16"
      },
      "commsCostsByCountry": {
        "base": "24745.73",
        "badDebtProvision": "989.83"
      },
      "saOperatingCosts": {
        "base": "12568761.50",
        "badDebtProvision": "502750.46"
      },
      "laDataPrepCosts": {
        "base": "0.00",
        "badDebtProvision": "0.00"
      },
      "saSetUpCosts": {
        "base": "12568761.50",
        "badDebtProvision": "502750.46"
      }
    },
    {
      "producerName": "P3 and P4 Sub 1",
      "producerID": "110000",
      "subsidiaryID": "110001",
      "level": 2,
      "totalBill": "8108627.95",
      "invoice": {
        "instruction": "-",
        "suggestedAmount": null,
        "invoicedToDate": null
      },
      "disposalFeesByMaterial": [
        {
          "material": "Aluminium",
          "previousInvoicedTonnage": "-",
          "householdPackagingWasteTonnage": 1295.476,
          "publicBinTonnage": 0,
          "totalTonnage": 1295.476,
          "selfManagedConsumerWasteTonnage": 0,
          "netTonnage": 1295.476,
          "feeWithoutBadDebt": "5.96",
          "tonnageChange": "-",
          "badDebtProvision": "0.24",
          "fee": "6.20",
          "england": "3.35",
          "wales": "0.76",
          "scotland": "1.50",
          "northernIreland": "0.59"
        },
        {
          "material": "Fibre composite",
          "previousInvoicedTonnage": "-",
          "householdPackagingWasteTonnage": 0,
          "publicBinTonnage": 0,
          "totalTonnage": 0,
          "selfManagedConsumerWasteTonnage": 0,
          "netTonnage": 0,
          "feeWithoutBadDebt": "0.00",
          "tonnageChange": "-",
          "badDebtProvision": "0.00",
          "fee": "0.00",
          "england": "0.00",
          "wales": "0.00",
          "scotland": "0.00",
          "northernIreland": "0.00"
        },
        {
          "material": "Glass",
          "previousInvoicedTonnage": "-",
          "householdPackagingWasteTonnage": 0,
          "publicBinTonnage": 0,
          "householdDrinksContainersTonnageGlass": 0,
          "totalTonnage": 0,
          "selfManagedConsumerWasteTonnage": 0,
          "netTonnage": 0,
          "feeWithoutBadDebt": "0.00",
          "tonnageChange": "-",
          "badDebtProvision": "0.00",
          "fee": "0.00",
          "england": "0.00",
          "wales": "0.00",
          "scotland": "0.00",
          "northernIreland": "0.00"
        },
        {
          "material": "Paper or card",
          "previousInvoicedTonnage": "-",
          "householdPackagingWasteTonnage": 0,
          "publicBinTonnage": 0,
          "totalTonnage": 0,
          "selfManagedConsumerWasteTonnage": 0,
          "netTonnage": 0,
          "feeWithoutBadDebt": "0.00",
          "tonnageChange": "-",
          "badDebtProvision": "0.00",
          "fee": "0.00",
          "england": "0.00",
          "wales": "0.00",
          "scotland": "0.00",
          "northernIreland": "0.00"
        },
        {
          "material": "Plastic",
          "previousInvoicedTonnage": "-",
          "householdPackagingWasteTonnage": 0,
          "publicBinTonnage": 0,
          "totalTonnage": 0,
          "selfManagedConsumerWasteTonnage": 0,
          "netTonnage": 0,
          "feeWithoutBadDebt": "0.00",
          "tonnageChange": "-",
          "badDebtProvision": "0.00",
          "fee": "0.00",
          "england": "0.00",
          "wales": "0.00",
          "scotland": "0.00",
          "northernIreland": "0.00"
        },
        {
          "material": "Steel",
          "previousInvoicedTonnage": "-",
          "householdPackagingWasteTonnage": 0,
          "publicBinTonnage": 0,
          "totalTonnage": 0,